{
  "schema_version": 1,
  "catalog": {
    "name": "adk-rust-pattern-catalog",
    "version": "0.1.0",
    "updated": "2026-08-29",
    "repository": "https://github.com/RyderFreeman4Logos/adk-workflow-kit",
    "license": "Apache-2.0",
    "adk_rust": {
      "requirement": "=2.3.0",
      "version": "2.1.0",
      "commit": "993126f18b8038123efe98566d4e058bd69c0f4e",
      "license": "Apache-2.0",
      "cargo_lock": {
        "package": "adk-rust",
        "version": "2.3.0",
        "source": "registry+https://github.com/rust-lang/crates.io-index",
        "checksum": "505a83604d4e5919b011cdb59c0aa93ec40bec86ea86e3b2930c32a122408a52"
      }
    },
    "policy": {
      "official_baseline": "tagged ADK-Rust v2.1.0",
      "third_party_rule": "version-independent patterns only",
      "no_copied_adk_types": true,
      "constraints": [
        "no GitHub Actions or hosted CI",
        "no M1 expansion",
        "no new focused issues without demonstrated in-repo need"
      ]
    }
  },
  "official": [
    {
      "id": "official-structured-output-after-stream",
      "name": "Parse structured output after stream completion",
      "class": "adopt",
      "value": "high",
      "version": "2.1.0",
      "commit": "993126f18b8038123efe98566d4e058bd69c0f4e",
      "license": "Apache-2.0",
      "compatibility": "adk-rust-2.x",
      "source_paths": [
        "docs/official_docs/agents/llm-agent.md",
        "docs/official_docs/tools/schema-normalization.md",
        "examples/output_schema_agent/src/main.rs"
      ],
      "source_links": [
        "https://github.com/zavora-ai/adk-rust/blob/993126f18b8038123efe98566d4e058bd69c0f4e/docs/official_docs/agents/llm-agent.md",
        "https://github.com/zavora-ai/adk-rust/blob/993126f18b8038123efe98566d4e058bd69c0f4e/docs/official_docs/tools/schema-normalization.md",
        "https://github.com/zavora-ai/adk-rust/blob/993126f18b8038123efe98566d4e058bd69c0f4e/examples/output_schema_agent/src/main.rs"
      ],
      "tests": {
        "upstream_paths": [],
        "in_repo": ["just pattern-catalog-test"]
      },
      "security_assumptions": [
        "The host validates the final typed value and never treats an early state delta as proof of schema validity.",
        "Schema repair remains bounded and malformed output fails closed."
      ],
      "rationale": "The repository already has typed workflow and review boundaries; this keeps model output outside the authoritative reducer until validation succeeds.",
      "in_repo_need": "workflow-review and workflow-testkit require deterministic, fail-closed structured outcomes."
    },
    {
      "id": "official-bounded-sequential-review",
      "name": "Bounded sequential draft and review stages",
      "class": "adopt",
      "value": "high",
      "version": "2.1.0",
      "commit": "993126f18b8038123efe98566d4e058bd69c0f4e",
      "license": "Apache-2.0",
      "compatibility": "adk-rust-2.x",
      "source_paths": [
        "docs/official_docs/agents/workflow-agents.md",
        "examples/functional_workflow/src/main.rs"
      ],
      "source_links": [
        "https://github.com/zavora-ai/adk-rust/blob/993126f18b8038123efe98566d4e058bd69c0f4e/docs/official_docs/agents/workflow-agents.md",
        "https://github.com/zavora-ai/adk-rust/blob/993126f18b8038123efe98566d4e058bd69c0f4e/examples/functional_workflow/src/main.rs"
      ],
      "tests": {
        "upstream_paths": [],
        "in_repo": ["just pattern-catalog-test"]
      },
      "security_assumptions": [
        "Each stage receives only the bounded state allowed by the workflow contract.",
        "A later review stage cannot turn an incomplete or invalid prior stage into success."
      ],
      "rationale": "A sequential workflow agent is the smallest ADK primitive for the repository's existing draft-review-revise and validation flows.",
      "in_repo_need": "workflow-compiler and workflow-review already model ordered stages and typed review verdicts."
    },
    {
      "id": "official-deterministic-graph-routing",
      "name": "Deterministic graph routing with explicit terminal states",
      "class": "adopt",
      "value": "high",
      "version": "2.1.0",
      "commit": "993126f18b8038123efe98566d4e058bd69c0f4e",
      "license": "Apache-2.0",
      "compatibility": "adk-rust-2.x",
      "source_paths": [
        "docs/official_docs/agents/graph-agents.md",
        "examples/graph_goto_routing/src/main.rs"
      ],
      "source_links": [
        "https://github.com/zavora-ai/adk-rust/blob/993126f18b8038123efe98566d4e058bd69c0f4e/docs/official_docs/agents/graph-agents.md",
        "https://github.com/zavora-ai/adk-rust/blob/993126f18b8038123efe98566d4e058bd69c0f4e/examples/graph_goto_routing/src/main.rs"
      ],
      "tests": {
        "upstream_paths": [],
        "in_repo": ["just pattern-catalog-test"]
      },
      "security_assumptions": [
        "Only declared edges and typed state transitions are reachable.",
        "Cancellation, budget exhaustion, and invalid routing remain explicit non-success outcomes."
      ],
      "rationale": "The graph primitive maps to existing workflow IR routing without copying ADK implementation types across the public boundary.",
      "in_repo_need": "workflow-ir and workflow-runtime already enforce declared routes, bounded cycles, and terminal mapping."
    },
    {
      "id": "official-checkpoint-artifact-boundary",
      "name": "Checkpoint state through an artifact boundary",
      "class": "wrap",
      "value": "high",
      "version": "2.1.0",
      "commit": "993126f18b8038123efe98566d4e058bd69c0f4e",
      "license": "Apache-2.0",
      "compatibility": "adk-rust-2.x",
      "source_paths": [
        "docs/official_docs/artifacts/artifacts.md",
        "examples/delta_checkpoints/src/main.rs"
      ],
      "source_links": [
        "https://github.com/zavora-ai/adk-rust/blob/993126f18b8038123efe98566d4e058bd69c0f4e/docs/official_docs/artifacts/artifacts.md",
        "https://github.com/zavora-ai/adk-rust/blob/993126f18b8038123efe98566d4e058bd69c0f4e/examples/delta_checkpoints/src/main.rs"
      ],
      "tests": {
        "upstream_paths": [],
        "in_repo": ["just pattern-catalog-test"]
      },
      "security_assumptions": [
        "Artifact identity, content hashes, and retention policy remain owned by the host boundary.",
        "ADK state is never treated as an ACL or source-of-truth replacement."
      ],
      "rationale": "ADK artifacts can carry execution material, while the existing repository owns durable hashes, locks, and replay semantics.",
      "in_repo_need": "workflow-testkit and workflow-runtime already expose artifact and checkpoint contracts that need an orchestration adapter."
    },
    {
      "id": "official-tool-authorization-wrapper",
      "name": "Allowlisted tool authorization wrapper",
      "class": "wrap",
      "value": "high",
      "version": "2.1.0",
      "commit": "993126f18b8038123efe98566d4e058bd69c0f4e",
      "license": "Apache-2.0",
      "compatibility": "adk-rust-2.x",
      "source_paths": ["docs/official_docs/security/tool-authorization.md"],
      "source_links": [
        "https://github.com/zavora-ai/adk-rust/blob/993126f18b8038123efe98566d4e058bd69c0f4e/docs/official_docs/security/tool-authorization.md"
      ],
      "tests": {
        "upstream_paths": [],
        "in_repo": ["just pattern-catalog-test"]
      },
      "security_assumptions": [
        "Authorization is checked by the host allowlist before dispatch.",
        "ADK tool declarations do not grant filesystem, network, or secret access by themselves."
      ],
      "rationale": "The repository already has capability intersection and ToolBridge authorization; ADK tools must be wrapped rather than trusted directly.",
      "in_repo_need": "workflow-runtime and workflow-testkit require an allowlisted typed tool envelope at the ADK boundary."
    },
    {
      "id": "official-arbitrary-code-action",
      "name": "Unrestricted arbitrary code action",
      "class": "reject",
      "value": "low",
      "version": "2.1.0",
      "commit": "993126f18b8038123efe98566d4e058bd69c0f4e",
      "license": "Apache-2.0",
      "compatibility": "adk-rust-2.x",
      "source_paths": ["examples/action_nodes/src/scenarios/code_node.rs"],
      "source_links": [
        "https://github.com/zavora-ai/adk-rust/blob/993126f18b8038123efe98566d4e058bd69c0f4e/examples/action_nodes/src/scenarios/code_node.rs"
      ],
      "tests": {
        "upstream_paths": [],
        "in_repo": ["just pattern-catalog-test"]
      },
      "security_assumptions": [
        "A general code action would violate the repository's sandbox and capability policy unless separately admitted.",
        "No model-controlled code execution is enabled by catalog membership."
      ],
      "rationale": "The example is useful evidence that the upstream surface exists, not evidence that arbitrary code is safe for this repository.",
      "in_repo_need": "No demonstrated M1-M2 need exists for arbitrary code execution; the secure sandbox boundary is already explicit."
    },
    {
      "id": "official-generic-host-shell",
      "name": "Generic host shell tool",
      "class": "reject",
      "value": "low",
      "version": "2.1.0",
      "commit": "993126f18b8038123efe98566d4e058bd69c0f4e",
      "license": "Apache-2.0",
      "compatibility": "adk-rust-2.x",
      "source_paths": ["examples/streaming_bash/src/main.rs"],
      "source_links": [
        "https://github.com/zavora-ai/adk-rust/blob/993126f18b8038123efe98566d4e058bd69c0f4e/examples/streaming_bash/src/main.rs"
      ],
      "tests": {
        "upstream_paths": [],
        "in_repo": ["just pattern-catalog-test"]
      },
      "security_assumptions": [
        "A host shell is not an allowlisted read-only service and must not receive model-controlled arguments.",